{
 "id":"6e3d5b6b-9534-4717-b9ec-a20b8b257442",
 "user_id": "045cbcac-a9a2-4c3d-8c3f-5f005aa47643",
 "created_at": "2017-04-10T18:50:12.171Z",
 "model": "dataset",
 "model_id": "2f93ba6f-fb31-4db9-b83c-98191528f2d1",
 "text": "The data provided is not relevant without controls. Does anyone found some?"
}
