{
 "id":"6e3d5b6b-9534-4717-b9ec-a20b8b257442",
 "user_id": "045cbcac-a9a2-4c3d-8c3f-5f005aa47643",
 "created_at": "2017-04-16T00:42:17.631Z",
 "model": "request",
 "model_id": "61e18ecb-93ab-4e98-a3c4-e6f9e877cb0e",
 "text": "Have you tried searching using the `datasource: DBGAP`?\n\n I managed to find some interesting data there."
}
